{
  "$schema": "https://json-schema.org/draft/2020-12/schema",
  "$id": "https://github.com/atongrun/health-bridge/contracts/sync-batch.schema.json",
  "title": "Health Bridge samples batch (design baseline)",
  "description": "Samples envelope structural schema. Semantic type/unit/time/metadata checks and other kinds are scheduled for P01a.",
  "type": "object",
  "additionalProperties": false,
  "required": [
    "schema_version",
    "batch_id",
    "stream_id",
    "server_generation",
    "publisher_epoch",
    "seq",
    "kind",
    "type",
    "query_completed_at",
    "scan_state",
    "samples",
    "deletions"
  ],
  "properties": {
    "schema_version": {
      "const": "1.0"
    },
    "batch_id": {
      "type": "string",
      "pattern": "^[0-9a-f]{8}-[0-9a-f]{4}-[0-9a-f]{4}-[0-9a-f]{4}-[0-9a-f]{12}$"
    },
    "stream_id": {
      "type": "string",
      "pattern": "^[0-9a-f]{8}-[0-9a-f]{4}-[0-9a-f]{4}-[0-9a-f]{4}-[0-9a-f]{12}$"
    },
    "server_generation": {
      "type": "string",
      "pattern": "^[0-9a-f]{8}-[0-9a-f]{4}-[0-9a-f]{4}-[0-9a-f]{4}-[0-9a-f]{12}$"
    },
    "publisher_epoch": {
      "type": "string",
      "pattern": "^[0-9a-f]{8}-[0-9a-f]{4}-[0-9a-f]{4}-[0-9a-f]{4}-[0-9a-f]{12}$"
    },
    "seq": {
      "type": "integer",
      "minimum": 1
    },
    "kind": {
      "const": "samples"
    },
    "type": {
      "enum": [
        "HKQuantityTypeIdentifierActiveEnergyBurned",
        "HKQuantityTypeIdentifierStepCount",
        "HKQuantityTypeIdentifierAppleExerciseTime",
        "HKQuantityTypeIdentifierHeartRate",
        "HKQuantityTypeIdentifierHeartRateRecoveryOneMinute",
        "HKQuantityTypeIdentifierRestingHeartRate",
        "HKQuantityTypeIdentifierHeartRateVariabilitySDNN",
        "HKQuantityTypeIdentifierVO2Max",
        "HKQuantityTypeIdentifierWalkingHeartRateAverage",
        "HKQuantityTypeIdentifierRespiratoryRate",
        "HKQuantityTypeIdentifierOxygenSaturation",
        "HKQuantityTypeIdentifierAppleSleepingWristTemperature",
        "HKQuantityTypeIdentifierBodyMass",
        "HKQuantityTypeIdentifierHeight",
        "HKQuantityTypeIdentifierSwimmingStrokeCount",
        "HKQuantityTypeIdentifierDistanceSwimming",
        "HKQuantityTypeIdentifierDistanceWalkingRunning",
        "HKQuantityTypeIdentifierDistanceCycling",
        "HKQuantityTypeIdentifierDistanceWheelchair",
        "HKQuantityTypeIdentifierDistanceDownhillSnowSports",
        "HKCategoryTypeIdentifierSleepAnalysis",
        "HKWorkoutTypeIdentifier"
      ]
    },
    "query_completed_at": {
      "type": "string",
      "format": "date-time",
      "pattern": "^\\d{4}-\\d{2}-\\d{2}T\\d{2}:\\d{2}:\\d{2}(\\.\\d{1,6})?(Z|[+-]\\d{2}:\\d{2})$"
    },
    "scan_state": {
      "enum": [
        "more",
        "drained"
      ]
    },
    "samples": {
      "type": "array",
      "maxItems": 500,
      "items": {
        "type": "object",
        "additionalProperties": false,
        "required": [
          "uuid",
          "type",
          "kind",
          "start",
          "end",
          "source",
          "metadata"
        ],
        "properties": {
          "uuid": {
            "type": "string",
            "pattern": "^[0-9a-f]{8}-[0-9a-f]{4}-[0-9a-f]{4}-[0-9a-f]{4}-[0-9a-f]{12}$"
          },
          "type": {
            "enum": [
              "HKQuantityTypeIdentifierActiveEnergyBurned",
              "HKQuantityTypeIdentifierStepCount",
              "HKQuantityTypeIdentifierAppleExerciseTime",
              "HKQuantityTypeIdentifierHeartRate",
              "HKQuantityTypeIdentifierHeartRateRecoveryOneMinute",
              "HKQuantityTypeIdentifierRestingHeartRate",
              "HKQuantityTypeIdentifierHeartRateVariabilitySDNN",
              "HKQuantityTypeIdentifierVO2Max",
              "HKQuantityTypeIdentifierWalkingHeartRateAverage",
              "HKQuantityTypeIdentifierRespiratoryRate",
              "HKQuantityTypeIdentifierOxygenSaturation",
              "HKQuantityTypeIdentifierAppleSleepingWristTemperature",
              "HKQuantityTypeIdentifierBodyMass",
              "HKQuantityTypeIdentifierHeight",
              "HKQuantityTypeIdentifierSwimmingStrokeCount",
              "HKQuantityTypeIdentifierDistanceSwimming",
              "HKQuantityTypeIdentifierDistanceWalkingRunning",
              "HKQuantityTypeIdentifierDistanceCycling",
              "HKQuantityTypeIdentifierDistanceWheelchair",
              "HKQuantityTypeIdentifierDistanceDownhillSnowSports",
              "HKCategoryTypeIdentifierSleepAnalysis",
              "HKWorkoutTypeIdentifier"
            ]
          },
          "kind": {
            "enum": [
              "quantity",
              "category",
              "workout"
            ]
          },
          "start": {
            "type": "string",
            "format": "date-time",
            "pattern": "^\\d{4}-\\d{2}-\\d{2}T\\d{2}:\\d{2}:\\d{2}(\\.\\d{1,6})?(Z|[+-]\\d{2}:\\d{2})$"
          },
          "end": {
            "type": "string",
            "format": "date-time",
            "pattern": "^\\d{4}-\\d{2}-\\d{2}T\\d{2}:\\d{2}:\\d{2}(\\.\\d{1,6})?(Z|[+-]\\d{2}:\\d{2})$"
          },
          "source": {
            "type": "object",
            "additionalProperties": false,
            "required": [
              "bundle_id",
              "name",
              "version",
              "os_version",
              "product_type",
              "device"
            ],
            "properties": {
              "bundle_id": {
                "type": [
                  "string",
                  "null"
                ],
                "maxLength": 256
              },
              "name": {
                "type": [
                  "string",
                  "null"
                ],
                "maxLength": 256
              },
              "version": {
                "type": [
                  "string",
                  "null"
                ],
                "maxLength": 256
              },
              "os_version": {
                "type": [
                  "string",
                  "null"
                ],
                "maxLength": 256
              },
              "product_type": {
                "type": [
                  "string",
                  "null"
                ],
                "maxLength": 256
              },
              "device": {
                "type": [
                  "object",
                  "null"
                ],
                "additionalProperties": false,
                "properties": {
                  "manufacturer": {
                    "type": [
                      "string",
                      "null"
                    ],
                    "maxLength": 256
                  },
                  "model": {
                    "type": [
                      "string",
                      "null"
                    ],
                    "maxLength": 256
                  },
                  "hardware_version": {
                    "type": [
                      "string",
                      "null"
                    ],
                    "maxLength": 256
                  },
                  "software_version": {
                    "type": [
                      "string",
                      "null"
                    ],
                    "maxLength": 256
                  }
                }
              }
            }
          },
          "metadata": {
            "type": "object",
            "maxProperties": 16,
            "additionalProperties": {
              "oneOf": [
                {
                  "type": "string",
                  "maxLength": 4096
                },
                {
                  "type": "number"
                },
                {
                  "type": "boolean"
                },
                {
                  "type": "object",
                  "additionalProperties": false,
                  "required": [
                    "value",
                    "unit"
                  ],
                  "properties": {
                    "value": {
                      "type": "number"
                    },
                    "unit": {
                      "enum": [
                        "m",
                        "degC",
                        "count",
                        "1",
                        "count/min"
                      ]
                    }
                  }
                }
              ]
            }
          },
          "quantity": {
            "type": "object",
            "additionalProperties": false,
            "required": [
              "value",
              "unit",
              "count"
            ],
            "properties": {
              "value": {
                "type": "number"
              },
              "unit": {
                "enum": [
                  "1",
                  "count",
                  "count/min",
                  "degC",
                  "kcal",
                  "kg",
                  "m",
                  "mL/(kg*min)",
                  "min",
                  "ms"
                ]
              },
              "count": {
                "type": "integer",
                "minimum": 1
              }
            }
          },
          "category": {
            "type": "object",
            "additionalProperties": false,
            "required": [
              "value",
              "label"
            ],
            "properties": {
              "value": {
                "type": "integer"
              },
              "label": {
                "type": "string",
                "maxLength": 64
              }
            }
          },
          "workout": {
            "type": "object",
            "additionalProperties": false,
            "required": [
              "activity_type",
              "duration_seconds"
            ],
            "properties": {
              "activity_type": {
                "type": "integer",
                "minimum": 0
              },
              "duration_seconds": {
                "type": "number",
                "minimum": 0
              }
            }
          }
        },
        "oneOf": [
          {
            "properties": {
              "kind": {
                "const": "quantity"
              }
            },
            "required": [
              "quantity"
            ],
            "not": {
              "anyOf": [
                {
                  "required": [
                    "category"
                  ]
                },
                {
                  "required": [
                    "workout"
                  ]
                }
              ]
            }
          },
          {
            "properties": {
              "kind": {
                "const": "category"
              }
            },
            "required": [
              "category"
            ],
            "not": {
              "anyOf": [
                {
                  "required": [
                    "quantity"
                  ]
                },
                {
                  "required": [
                    "workout"
                  ]
                }
              ]
            }
          },
          {
            "properties": {
              "kind": {
                "const": "workout"
              }
            },
            "required": [
              "workout"
            ],
            "not": {
              "anyOf": [
                {
                  "required": [
                    "quantity"
                  ]
                },
                {
                  "required": [
                    "category"
                  ]
                }
              ]
            }
          }
        ]
      }
    },
    "deletions": {
      "type": "array",
      "maxItems": 500,
      "items": {
        "type": "object",
        "additionalProperties": false,
        "required": [
          "uuid",
          "type"
        ],
        "properties": {
          "uuid": {
            "type": "string",
            "pattern": "^[0-9a-f]{8}-[0-9a-f]{4}-[0-9a-f]{4}-[0-9a-f]{4}-[0-9a-f]{12}$"
          },
          "type": {
            "type": "string",
            "maxLength": 128
          }
        }
      }
    }
  }
}
